idNumber|name|description|distanceArray|store
1|Phuket|Your home. A paradisiac island, summer all year. Hope you are ready for the beach.|0, 2, 7, 9, 3|1
2|Aztecs Island|The ancient civilization has hidden treasures in this selvatic island.|2, 0, 6, 8, 6|2
3|Shetland Islands|A subartic archipelago used by Vikings for pirate expeditions.|7, 6, 0, 6, 5|3
4|Bermuda Triangle|A misterious place with richness but also dangerousness.|9, 8, 6, 0, 4|4
5|Trasmoz|A place populated by devil stories that might be for real.|3, 5, 6, 4, 0|5